name,party,speech
"
Otto Fricke",FDP,"Ich bitte vielmals um Entschuldigung, Frau Präsiden-
tin. Großer Fehler! Das kommt davon, weil ich mich in 
Ihrer Nähe immer so wohlfühle, dass ich das gar nicht merke.

Ja also, wenn man schon Fehler macht, dann muss man sich auch gut entschuldigen.
(Heiterkeit)
Sehr geehrter Herr Kollege Thies, dass Sie nicht im 
Rechtsausschuss gesessen haben, als wir das alles beraten 
und beschlossen haben, hat man gemerkt. Ich will im 
Hinblick darauf, dass Sie schon zehn Jahre länger als ich Anwalt sind, es damit verbinden, dass Sie sicherlich 
andere wichtige Dinge getan haben. Aber wir wollen 
doch ein paar Sachen an dieser Stelle richtigstellen.
Ich freue mich sehr darüber, dass, nachdem wir als 
FDP einen Antrag zu den 3 Milliarden Euro für die Ukrai-
nehilfe durch den Bundestag gebracht haben, wir nun sogar einen solch umfangreichen Gesetzentwurf hier durch den Bundestag bringen – natürlich mit den Stim -
men von SPD und Grünen. Ich danke an dieser Stelle auch sehr herzlich dafür, dass wir zeigen können, dass, wenn es um die Sache geht – wenn es übrigens in der 
Öffentlichkeit auch nicht hochgespielt wird –, man in der 
Lage ist, Kompromisse zu finden.
So sind wir in der Lage, für ganz viele – da haben Sie es 
richtig benannt – beruflich unterschiedlich Tätige im Be-
reich der Justiz etwas Gutes zu tun. Warum tun wir etwas 
Gutes? Das ist vielleicht wichtig für diejenigen, die sich nicht so sehr mit der Thematik auskennen. Am Ende sind 
alle, die im Bereich der Justiz beschäftigt sind, immer 
davon abhängig, dass ihre Gebühren angepasst werden, und das geschieht immer nachgängig. Wir haben das ganz 
stark während Corona und bei der Frage der damit ver -
bundenen Einbußen gemerkt. Deswegen mussten wir und 
haben wir auch geschaut, wie wir das nachvollziehen können.
Heute machen wir sehr viel Technisches. Ich könnte 
jetzt viel zu Streitwerten und Vergütungstatbeständen er-klären. Ich könnte was zu der Frage sagen: Wie ist der 
Vergleich mit den Steuerberatern, die natürlich eine Er-
höhung bekommen haben, oder den Ärzten, die sie auch schon längst bekommen haben? Wahrscheinlich waren 
Sie gestern Abend an anderer Stelle, als wir noch einiges 
im Gesundheitsbereich beschlossen haben. Das hier vor -
liegende Gesetz umfasst eine längst notwendige Vollzie-hung der Anpassungen, die wir nicht vorgenommen ha-
ben, was auch daran lag, dass mit dem Ende der Ampel 
nicht die Möglichkeit bestand, hier sofort etwas zu be-schließen. Und noch einmal: Ich finde es dann gut – und 
es gehört zur Demokratie dazu –, dass man das dann auch 
machen kann.
Ich fange mit der Betreuervergütung an; denn auch hier 
geht es um Teilhabe an unserer Gesellschaft und um Teilhabe am Recht. Ich bin froh, dass wir den Ehren-amtlichen und den Betreuervereinen helfen, hier die ent-sprechende Betreuervergütung anpassen und – Achtung, 
das will ich auch sagen – eine Vereinfachung des Ver-
gütungssystems vornehmen. Diese Vereinfachung ist not-wendig, damit man am Ende schneller zu Geld kommt. 
Außerdem haben wir enorme Probleme beim Nachwuchs 
im Bereich der Betreuer, und auch deswegen müssen wir an der Stelle etwas tun.
Meine Damen und Herren, zur Rechtsanwaltsver-
gütung. Ich will das ganz deutlich sagen: Ja, wir haben ein Riesenproblem beim Zugang zum Recht. Für diejeni-
gen, die es nicht besser wissen, sondern glauben, dass die 
Gebühren, die sich nach den Gebührentatbeständen rich-ten, das sind, was der Anwalt bekommt, will ich noch mal erklären: Es gibt einen Unterschied zwischen Einnahme 
und Gewinn. Das darf man bei dem Kostenapparat, den 
ein Anwalt ob der Sorgfaltspflichten, die er hat, bitte nicht vergessen.
Die Anpassungen sind notwendig. Gleichzeitig stehen 
wir aber vor dem Problem, dass gerade bei kleineren Mandaten die Frage ist: Lohnt sich das noch? Die alte 
Idee eines Mixes – kleines Mandat und großes Mandat; 
bei dem einen verdiene ich, um das andere mitzumachen – wird immer mehr wegfallen. Das fördert Legal Tech. Das muss es auch im Rahmen eines Wettbewerbes durchaus 
geben, wenn die entsprechenden Sorgfalten da sind. Aber 
es führt natürlich auch dazu, dass der – und das meine ich positiv – Feld-Wald-und-Wiesen-Anwalt, der um die 
Ecke, zu dem ich gehen kann, um meine täglichen Pro -
bleme zu lösen, immer weniger existiert, weil es für ihn in 
der Kostenstruktur keine Gewinnmöglichkeit gibt.
Hier schaffen wir die entsprechenden Anpassungen. 
Ich danke insbesondere dafür, dass wir das im Bereich des Familienrechts tun. Denn gerade hier war aufgrund des Verhältnisses von Bedeutung der Fälle und zeitlichem 
Aufwand der Fälle – der Anwalt ist hier nicht nur Anwalt, 
sondern, wie ich immer sage, auch Berater, Betreuer, Psychologe und vieles andere mehr – eine vernünftige 
Anpassung erforderlich.

Meine Damen und Herren, es ist an der Stelle notwen-
dig, dass wir das tun. Und da widerspreche ich der CDU/ CSU ausdrücklich. Wenn du etwas tun kannst, was du 
machen musst – und das haben Sie dem Grunde nach anerkannt –, dann mache es auch! Stellt einen Antrag, 
dass ihr mehr haben wollt; dann kann man gucken, ob 
es eine Mehrheit findet oder nicht. Aber seitens der CDU/ CSU sollte man doch wenigstens das, was man an der Stelle hinbekommen hat, unterstützen. Ich befürchte so -
gar, dass aufgrund Ihrer Äußerungen dahinter eigentlich ein anderer Plan steht.
Damit komme ich zum Schluss meiner Rede. Am Ende 
ist dieser Gesetzentwurf mit seinen, ich glaube, 18 Arti-keln wieder von den Ländern abhängig. Es ist ein Zu-stimmungsgesetz. Wie es seit 1996 in diesem Hause der 
Fall ist, ist es mal wieder so, dass die Länder den Bund 
erpressen und sagen: Wir stimmen nur zu, wenn auch die Gerichtsgebühren erhöht werden.
Herr Brandner, wir stimmen ja nachher noch über den 
von Ihnen und der AfD eingebrachten Änderungsantrag ab. Wenn Sie fordern: „Keine Gerichtsgebührenerhöhun-gen!“, dann tun Sie den Anwälten einen Tort an. Sie 
sorgen dann am Ende nämlich dafür, dass die Länder 
auch die Erhöhung für die Anwälte killen, weil sie ihre Deutscher Bundestag – 20. Wahlperiode – 211. Sitzung. Berlin, Freitag, den 31. Januar 2025                                                                                                                                                                                                27563 
(A) 
(B) (C) 
(D) 
Gebührenerhöhung nicht bekommen. Fraglich bleibt, ob 
die CDU/CSU dann wirklich so handelt, wie sie das je-
denfalls hier im Bundestag macht. Da hoffe ich mal auf die Einsichtsfähigkeit der Ministerpräsidenten.
Meine Damen und Herren, zum Schluss: Es geht hier 
darum, dass wir das Recht und den Zugang zum Recht stärken. Denn wie heißt es so schön bei Schiller in der 
„Geschichte des Abfalls der vereinigten Niederlande von 
der spanischen Regierung“: „Wenn das Recht nicht ent -
scheiden kann, so tut es die Stärke.“
Herzlichen Dank."
"
Stephan Brandner",AfD,"Frau Präsidentin, ich vergesse Sie nie!
(Helge Limburg [BÜNDNIS 90/DIE GRÜ-
NEN]: Ich glaube, das fände sie jetzt nicht so 
schlimm!)
Meine Damen und Herren! Zu später Freitagsstunde eine 
kurze Debatte über V ormünder, Betreuervergütung, 
Rechtsanwaltsvergütung – ein bisschen Klientelpolitik 
aus dem Hause der FDP, gerade wenn es um die Rechts -
anwälte geht. Aber ich habe im Ausschuss schon gesagt: 
Nicht jede Klientelpolitik muss ja verkehrt sein. Und hier 
ist sie weiß Gott nicht verkehrt; denn der Rechtsstaat braucht diese Berufsgruppen, und diese Berufsgruppen brauchen auch mehr Geld. Das ist eigentlich unstrittig.
Sie leiden, wie auch die Gerichtsvollzieher, die wir 
zusätzlich noch bedenken wollen – ungefähr 4 300 Ge-
richtsvollzieher gibt es in Deutschland –, unter der kata-
strophalen Finanz- und Wirtschaftspolitik dieser Kata-
strophenregierung. Mit dieser Erhöhung der Vergütungen und der Anpassung der entsprechenden Vor-
schriften kann man ein bisschen das abfedern, was da an 
Schaden angerichtet worden ist.
Es geht hier um einen moderaten Zuwachs und einen 
Inflationsausgleich für rund 160 000 Rechtsanwälte, de-
ren Mitarbeiter und Familien – also für Pi mal Daumen 500 000 bis 600 000 Menschen in Deutschland –, denen wir hier ein bisschen was Gutes tun; denn deren Einnah -
men sind nicht in dem gleichen Maße gestiegen wie die Inflation oder die Kosten. So weit, so gut.
In der letzten Wahlperiode hatte sich die AfD dieses 
Thema auf die Fahnen geschrieben. Ganz am Anfang, ich glaube, 2018, hatten wir es schon eingebracht. Das hatte zur Folge, dass sich überhaupt nichts tat. Wir haben heute hier die Brandmauer-Debatte ja rauf- und runtergenudelt; 
die war auch damals schon aktuell. Wir hatten 2018 ge -
sagt, die Rechtsanwaltsvergütungen müssen angehoben 
werden. Dann haben Sie gesagt: „Das geht alles nicht“, 
und es wurde in die Länge gezogen. Sie haben sozusagen 
Ihren AfD-Hass auf dem Rücken dieser Berufsgruppen – der Rechtsanwälte, der Betreuer, der Gerichtsvollzieher – 
ausgetragen. Irgendwann wurde es dann mal was. In die -
ser Wahlperiode haben wir uns gesagt: Gut, dann lassen 
wir der FDP den V ortritt; dann funktioniert das flotter.
(Gabriele Katzmarek [SPD]: Der ist sich für 
nichts zu blöd da vorne!)
Der FDP-Hass ist noch nicht so ausgeprägt wie der AfD- Hass, und es hat ja letztendlich auch funktioniert.
Allerdings schießt die FDP – das war hinterher eine 
ganz große Koalition – wieder deutlich übers Ziel hinaus; der Kollege Fricke hat das am Ende seiner Rede hier 
angedeutet. Denn nicht nur die Vergütung dieser Berufs-
gruppen wird ja erhöht – was völlig in Ordnung ist; wir 
werden dabei nachher auch zustimmen –, sondern auch der Staat selber will sich bedenken. Also der Staat, der für 
Inflation und ruinöse Wirtschaftspolitik zuständig ist, 
sagt jetzt zu sich selber: „Das müssen wir auch irgendwie ausgleichen“, und die Gerichtskosten sollen nebenbei 
auch noch erhöht werden.
Der Kollege Fricke hat gerade gesagt – ich muss Ihnen 
ganz ehrlich sagen, dass ich über eine entsprechende Äu-ßerung im Ausschuss ein bisschen entsetzt war –: Die 
Länder erpressen den Bund. – Herr Fricke hat gerade hier vorne gesagt, die Länder würden den Gesetzentwurf „killen“, wenn die Gerichtskosten nicht erhöht werden.
(Otto Fricke [FDP]: So ist es!)
Wo sind wir in Deutschland denn gelandet? Ich dachte, wir hätten ein vernünftiges föderales System, wo man gut miteinander kann.
(Otto Fricke [FDP]: Wir haben ja auch nicht 
nur vernünftige Fraktionen!)
Aber Sie reden von Erpressung zwischen den einzelnen Ebenen, zwischen dem Bund und den Ländern. Sie sagen, 
der eine killt den anderen.
Ich wünschte mir – das muss ich ganz ehrlich sagen – 
einen anderen Umgang zwischen Bund und Ländern.
(Gabriele Katzmarek [SPD]: Ja, Sie können ja 
hier schon mal üben, einen anderen Umgang!)"
"
Beatrix von Storch",AfD,"Frau Präsidentin! Meine Damen und Herren! Man 
kann sich sein Geschlecht nicht aussuchen – und frau 
auch nicht. Wer es zulässt, dass Kinder wegen einer pu-
bertären Laune kastriert werden, der begeht ein Verbre-
chen. Einem Kind, das glaubt, ein einäugiger und ein-
beiniger Pirat zu sein, sticht man kein Auge aus, und dem hackt man auch kein Bein ab; man schickt es zum 
Psychologen oder Psychotherapeuten."
"
Anke Hennig",SPD,"Sehr geehrte Frau Präsidentin! Sehr geehrte Kollegin-
nen und Kollegen! Liebe Zuhörende! Die wiederholt queerfeindlichen Anträge der AfD und das gefährliche 
Spiel mit den Rechten der queeren Community sind nicht nur unannehmbar. Das ist ein direkter Angriff auf die Werte unserer Demokratie und unserer Gesellschaft.

Die AfD hat sich längst als Sammelbecken für Hass, 
Intoleranz und Menschenfeindlichkeit etabliert. Ihre Aus-sagen sind schlichtweg menschenverachtende Ideo-
logien,

die keinen Platz in einer modernen, freien Gesellschaft 
haben dürfen.

Das beweisen Sie mit Ihren Anträgen zum wiederhol-
ten Male. Darin fordern Sie etwa den Einsatz für eine 
familienfreundliche Gesellschaft,
(Stephan Brandner [AfD]: Was ist daran 
schlecht?)
ganz nach dem traditionellen Familienbild von Vater, 
Mutter und Kind,
(Beatrix von Storch [AfD]: Das ist ja grauen-
haft!)
während Ihre Parteivorsitzende doch in einer lesbischen 
Partnerschaft mit Frau und Kind lebt.
(Stephan Brandner [AfD]: Ja, und? Wen inte-
ressiert’s?)
Sie kann Arbeit und Privatleben offensichtlich sehr gut voneinander trennen; denn damit gehört sie per Defini-
tion zu eben jenem Personenkreis, den der Begriff 
„LGBTIQ“ umfasst.

Wie gut, dass Frau Weidel in der Schweiz lebt. Dadurch ist sie vor ihren eigenen Forderungen geschützt.
(Sonja Eichwede [SPD]: Hört! Hört!)
Aber auch an Sie, werte Kolleginnen und Kollegen der 
Unionsfraktion, möchte ich heute ein paar Worte richten.
(Stephan Brandner [AfD], an die CDU/CSU 
gewandt: So, jetzt seid ihr dran! Das AfD-Ba-
shing ist vorbei!)
Laut Wahlprogramm wollen Sie das Selbstbestimmungs-
gesetz zurücknehmen, zur Not erneut mit den Stimmen 
der AfD.Deutscher Bundestag – 20. Wahlperiode – 211. Sitzung. Berlin, Freitag, den 31. Januar 2025                                                                                                                                                                                                27567 
(A) 
(B) (C) 
(D) 
(Stephan Brandner [AfD]: Genau!)
Sie haben in dieser Woche Ihre staatspolitische Verant-
wortung an die AfD verkauft.
(Stephan Brandner [AfD]: Wir haben kein 
Geld bekommen!)
Wie können Sie eigentlich noch in den Spiegel schauen?

Am 27. Januar gedenken Sie noch betroffen der Opfer 
des Nationalsozialismus und sagen: „Nie wieder ist jetzt!“, um dann am 29. Januar, unmittelbar nach einer sehr eindrücklichen Gedenkstunde, zu sagen: Nie wie -
der? Das war gestern. – Das, liebe Mitglieder der Unions-fraktion, war ein Verrat an den Grundwerten unserer De-mokratie."
"
Anke Hennig",SPD,"Wir werden niemals zulassen, dass die Fortschritte, die 
durch uns in der Queerpolitik erreicht wurden, wieder 
zerstört werden.
(Beatrix von Storch [AfD]: Das war jetzt aber 
eine starke Geste, oder?)
Wir kämpfen weiter für das Recht auf ein selbstbestimm-
tes Leben von Trans-, Inter- und nichtbinären Menschen. Denn die Selbstbestimmung ist ein Menschenrecht, und 
Menschenrechte sind nicht verhandelbar.

Wir werden nicht zulassen, dass die queere Commu-
nity zurückgedrängt wird. Wir werden nicht zulassen, dass die Demokratie mit Füßen getreten wird. Die demo-kratische Mitte steht für eine Gesellschaft der Vielfalt, 
der Toleranz und des Respekts. Wir stehen für eine De-
mokratie, die für alle Menschen gleichermaßen gilt.
(Stephan Brandner [AfD]: Außer für die AfD, 
oder?)
Und wir werden uns niemals damit abfinden, dass diese Werte durch politische Taktiererei zerstört werden.
Schließen Sie sich dieser demokratischen Allianz an! 
Die Würde des Menschen ist unantastbar."
"
Jürgen Lenders",FDP,"Frau Präsidentin! Liebe Kolleginnen und Kollegen! 
Der Umgang mit Minderheiten in Deutschland ist stets 
ein verlässlicher Gradmesser für den Zustand unserer 
freiheitlichen Demokratie gewesen. Mit der heutigen De -
batte zeigt die AfD einmal mehr, was sie von genau dieser 
liberalen Demokratie hält, nämlich nichts. Ihre Anträge – 
auch wenn Sie einen Teil davon zurückgezogen haben – 
sind eine klare Kampfansage an alle Transpersonen und alle homosexuellen Menschen. Dass man als trans- oder 
homosexuelle Frau oder trans- oder homosexueller Mann 
jetzt noch die AfD wählen kann, ist mir wirklich unbe -
greiflich.

Meine Damen und Herren, liebe Kolleginnen und Kol-
legen, lassen Sie mich eins ganz deutlich sagen: Ich bin 
froh, dass wir in einem Land leben, in dem gesellschaft-
liche Vielfalt nicht mit Füßen getreten wird. Ob trans-, Deutscher Bundestag – 20. Wahlperiode – 211. Sitzung. Berlin, Freitag, den 31. Januar 2025                                                                                                                                                                                                27569 
(A) 
(B) (C) 
(D) Ekin Deligöz 
hetero-, homosexuell: Alle Menschen in Deutschland sol-
len ihren Lebensentwurf verwirklichen können. Für uns 
Freie Demokraten ist das ein wesentlicher Bestandteil unseres Leitbildes, unseres Freiheitsverständnisses. Zahl -
reiche Bürgerrechtsthemen haben wir deshalb als FDP in den letzten Koalitionsvertrag mit hineinverhandelt und auch umgesetzt.
Da ist zum Beispiel die verschärfte Strafbarkeit von 
homo- und transfeindlicher Hasskriminalität, die der ehe-malige Bundesjustizminister Marco Buschmann erreicht hat. Da ist aber auch das Selbstbestimmungsgesetz. Da-
mit wird – das ist ganz klar – die Würde von transsexuel-
len Menschen geachtet. Und da sind wir ein ganzes Stück weitergekommen. Wir haben ja auch oft genug hier an 
dieser Stelle darüber gesprochen.
Wir haben das sogenannte Diskretionsgebot abge-
schafft. Da möchte ich ausdrücklich Innenministerin Fae-ser dafür danken, dass sie das sehr unbürokratisch ge-
macht hat. Und es ist uns gelungen, die Diskriminierung von homo- und bisexuellen Männern bei der Blutspende abzuschaffen. Liebe Kolleginnen 
und Kollegen, dafür habe ich alleine 17 Jahre kämpfen 
müssen.

Außerdem haben wir den Nationalen Aktionsplan „Queer leben“ auf den Weg gebracht, der noch mit Leben gefüllt werden muss.
Aber, meine Damen und Herren, es ist eben eine Quer-
schnittsaufgabe, und darum war, ist und bleibt es richtig, eine Queer-Beauftragtenstelle zu haben. Das ist keine leichte Aufgabe für Sven Lehmann gewesen, und ich 
bedanke mich an dieser Stelle auch mal ganz ausdrück -
lich für die Arbeit, die er geleistet hat.

Wir als Freie Demokraten – und das will ich auch ganz 
deutlich sagen – haben uns für die kommende Legislatur 
noch viel vorgenommen. Wir wollen neue Akzente setzen und weitere Projekte umsetzen. Als Freie Demokraten 
möchten wir die Gesundheitsversorgung der LSBTI-Ge -
meinschaft weiter verbessern. Wir wollen dafür kämpfen, 
dass der Artikel 3 im Grundgesetz um die sexuelle Iden-
tität erweitert wird. Zudem muss nach der Bundestags-
wahl die Reform des Abstammungsrechts kommen; das hat meine Kollegin eben schon gesagt. Das sind drei 
Punkte von dem, was man sehr konkret angehen muss.
Liebe Kolleginnen und Kollegen, rund 11 Prozent der 
Menschen in Deutschland definieren sich als Teil der 
LSBTI-Community. Jede zweite befragte Person gibt 
an, eine homosexuelle oder queere Person in der Familie, 
im Freundeskreis oder unter Kollegen zu kennen. Das sind mehr als je zuvor. Dennoch gibt es einen Teil der 
Bevölkerung, der keinerlei Bezug zu queerpolitischen 
Themen hat. Gerade diese Menschen müssen wir mehr mitnehmen, ihre Fragen beantworten und mit ihnen ins 
Gespräch kommen.
(Nicole Höchst [AfD]: Es geht um die Kinder! 
Haben Sie die Anträge überhaupt gelesen? Das ist ja schändlich! – Gegenruf der Abg. 
Dr. Daniela De Ridder [SPD]: Ruhe!)
Das schafft Verständnis und Akzeptanz. Wir brauchen 
eine Diskurskultur, bei der wir uns auch gegenseitig zu-
hören.

Meine Damen und Herren, ich habe dreimal den An-
lauf gemacht, meine letzte Rede hier zu halten. Es wird 
diesmal wirklich meine letzte Rede gewesen sein.
(Heiterkeit bei Abgeordneten der FDP, der 
SPD und des BÜNDNISSES 90/DIE GRÜ-
NEN)
Nach 30 Jahren in der Politik insgesamt und nach 17 Jah-
ren im Hauptamt als Abgeordneter muss ich sagen: So 
einen Tag wie heute habe ich noch nie erlebt.

Ich hoffe auch, dass er sich so schnell nicht wiederholen wird.

Lassen Sie mich mit einem persönlichen Gedanken 
schließen. Die Welt hat sich in den letzten Jahrzehnten stark und mit einer ungeheuren Geschwindigkeit ver-
ändert.
(Beatrix von Storch [AfD]: Ja, jetzt wird’s 
langsam wieder besser!)
Meiner Meinung nach hat sie vor allem enorm an Ver-
änderbarkeit gewonnen. Es gibt mehr Politik, weil ein-
fach auch mehr zu verändern ist. Es lässt sich auch alles ändern. Hierin liegen große Herausforderungen, aber vor 
allen Dingen auch große Chancen für das Politische an 
sich und insbesondere für den Liberalismus.
In diesem Sinne wünsche ich mir, dass sich viele junge 
Menschen entschließen, in die Politik zu gehen. Der heu-
tige Tag war ein Beispiel dafür: Wir brauchen sie alle.
Vielen Dank."
"
Nicole Höchst",AfD,Frau Präsidentin! Werte Kollegen! An die Fake-News-
"
Kathrin Vogler",Die Linke,"Vielen Dank. – Frau Präsidentin! Liebe Kolleginnen 
und Kollegen! Die AfD legt hier heute wieder Anträge vor, die ihre rückwärtsgewandte Ideologie zeigen.
(Beatrix von Storch [AfD]: Es gibt nur zwei 
Geschlechter zum Beispiel!)
Familien- und gleichstellungspolitisch wollen Sie zurück in die 50er-Jahre oder sogar in die Zeit 20 Jahre davor.
(Stephan Brandner [AfD]: Lesen Sie mal Ihren 
Mao!)
Ich wurde unfreiwillig Ohrenzeugin, wie sich AfD- 
Abgeordnete in einer Kneipe Lebensborn und Mutter-kreuz zurückgewünscht haben und Frau Storch dort trans- und nicht-binäre Menschen verächtlich gemacht 
hat.
(Stephan Brandner [AfD]: Haben Sie wieder 
rumgespitzelt, oder? In Ihrer Stasimanier? Fremde Leute belauscht? Widerlich!)
Aber die Lebenswirklichkeit in unserem Land ist zum 
Glück längst viel weiter als Sie.

Trans- und nicht-binäre Menschen, Regenbogenfamilien 
sind Realität, und sie haben unsere Unterstützung und 
unseren Respekt verdient.

Die AfD ist sozial- und familienpolitisch ein Totalaus-
fall. Von ihrem Wahlprogramm würden vor allem Groß-verdiener und Vermögende profitieren. Eine vierköpfige 
Familie mit einem verfügbaren Einkommen von 
40 000 Euro im Jahr würde sogar 443 Euro verlieren. Und um von diesem unsozialen, familienfeindlichen Pro -
gramm abzulenken, schüren Sie Hass und Misstrauen gegen Minderheiten. Das ist einfach niederträchtig.

1) Anlage 8Deutscher Bundestag – 20. Wahlperiode – 211. Sitzung. Berlin, Freitag, den 31. Januar 2025                                 27572 
(A) 
(B) (C) 
(D) Dr. Stefan Kaufmann 
Nahezu jeder CSD in Deutschland ist inzwischen Ziel 
von rechtsextremen Gegendemos, von denen zum Teil 
auch Gewalt ausgeht. Und Sie schaffen mit Ihren Anträ-
gen, Ihren Anfragen und Ihrer Verächtlichmachung hier 
im Haus die Grundlage für diese Angriffe. Freie und 
selbstbestimmte Menschen sind Faschistinnen und Fa-schisten ein Gräuel.
Die Linke will, dass alle Menschen frei, in Würde und 
Sicherheit leben können.

Deswegen werden wir uns der AfD, ihrer Ideologie und 
ihren Steigbügelhaltern immer entgegenstellen, hier im 
Bundestag und draußen auf der Straße.

Wir werden den Faschismus aufhalten – gemeinsam. Und 
das ist ein Versprechen."
"
Beatrix von Storch",AfD,"Vielen herzlichen Dank. – Eine Kurzintervention oder 
persönliche Erklärung, weil ich direkt angesprochen wor-
den bin: Die Kollegin Vogler sagte, wir wären in der 
Parlamentarischen Gesellschaft gewesen, und ich hätte 
mich da irgendwie trans-, queer- und sonst-was-phob ge-äußert.
(Anke Hennig [SPD]: Das machen Sie doch in 
der Öffentlichkeit immer!)
Ich glaube, ich kann mich an den Abend sehr gut er-
innern. Sie saßen an dem Abend einen Tisch neben uns. An dem Tisch, an dem ich saß, habe ich gar nicht geredet, 
sondern ein zwölfjähriger Sohn eines unserer Abgeord-
netenkollegen. Er heißt Götz.
(Daniel Baldy [SPD]: Mit dem waren Sie in 
der Kneipe? Das ist ja sehr erwachsen!)
Und Götz, der zwölf Jahre alt ist, hat sehr laut erzählt von 
den Problemen, die er in der Schule hat. In seiner Klasse – 
Zwölfjährige –, hat er erzählt, gebe es, ich glaube, zwei Bisexuelle, einen Pansexuellen und einen Fuchs. Er wurde zum Direktor gerufen, weil er den Fuchs nicht 
als Fuchs behandelt hat, sondern irgendwie als Mitschü -
ler, und darüber hat er erzählt.
(Anke Hennig [SPD]: Wer soll Ihnen das denn 
glauben?)
Das Einzige, was ich an dem Abend gesagt habe, war, 
dass ich zu Götz gesagt habe: Götz, ich höre so schlecht; 
rede mal etwas lauter. – Das habe ich gesagt, damit Sie da drüben hören, was ein Zwölfjähriger aus einer ländlichen"
"
Beatrix von Storch",AfD,"Was für eine Katastrophe! Ich glaube, von dem Abend 
erzählen Sie. Ich will hier nur bestreiten, dass ich mich 
irgendwie-phob geäußert habe.
(Anke Hennig [SPD]: Das machen Sie in der 
Öffentlichkeit doch ständig!)
Vielen herzlichen Dank."
