name,party,speech
"
Karsten Hilse",AfD,"Vielen Dank, Frau Präsidentin, dass Sie die Kurzinter-
vention zulassen. – Herr Mehltretter, ich weiß jetzt nicht so richtig, ob es Boshaftigkeit ist oder ob es fehlende kognitive Fähigkeiten sind: Wir haben noch nie den Kli -
mawandel geleugnet.
(Lachen bei Abgeordneten der SPD und des 
BÜNDNISSES 90/DIE GRÜNEN)
Selbstverständlich gibt es einen Klimawandel – seit Hun-
derten Millionen von Jahren. Das Einzige, was wir sagen, 
ist, dass es keinen einzigen wissenschaftlichen Beweis dafür gibt, dass die menschengemachten CO
2-Emissio-
nen daran einen Anteil haben. Keinen einzigen wissen-schaftlichen Beweis!

Ihre weiteren Einlassungen zeigen sehr deutlich, dass 
es beim Kampf gegen rechts nicht gegen die AfD geht, sondern gegen jeden – und das sollte sich die CDU hinter 
die Ohren schreiben –, der diese Ideologie angreift, der 
die links-grüne Ideologie angreift. Das ist der Kampf 
gegen rechts. Es ist nicht allein der Kampf gegen die AfD, sondern auch der Kampf gegen alle, die diese Ideo -
logie infrage stellen.

Liebe CDU-Kollegen, ihr seht, was im Moment vor 
euren Zentralen los ist. Löst euch von diesen links-grünen 
Ideologen und macht endlich wieder konservative und 
vernunftorientierte Politik!"
"
Andreas Mehltretter",SPD,"Herr Kollege, Sie stellen sich mit dem, was Sie hier 
sagen, gegen den überwiegenden Konsens in der Fach-welt, gegen die gesamte Wissenschaft dieses Globus,

und das ist einfach falsch. Ihnen ist anscheinend völlig egal, dass Millionen Menschen unter Hochwasser, unter 
Hitze, unter Stürmen leiden,Deutscher Bundestag – 20. Wahlperiode – 211. Sitzung. Berlin, Freitag, den 31. Januar 2025                                 27512 
(A) 
(B) (C) 
(D) Andreas Mehltretter 
(Beatrix von Storch [AfD]: Unter Wind!)
dass wir jedes Jahr Milliardenschäden haben, dass es 
jedes Jahr schlimmer wird, weil wir auf diesem Planeten 
CO 2 ausstoßen. Das ist Ihnen völlig egal. Die Menschen 
sind Ihnen völlig egal, und das sollten wir in diesem Haus 
alle zusammen nicht hinnehmen.

Sie zeigen mit dieser Haltung, dass es Ihnen eben nicht 
nur um das Klima oder um irgendwelche fachlichen Fra-gen geht, sondern Sie haben gerade genau die Verbindung 
aufgemacht: Ihnen geht es ums große Ganze.

Ihnen geht es darum, hier keine demokratischen Mehr-heiten zuzulassen. Ihnen geht es darum, unserem Plane-ten und unserem Land zu schaden. Das sollten wir alle 
gemeinsam in diesem Haus nicht zulassen."
"

Thorsten Frei",CDU/CSU,"Frau Präsidentin! Liebe Kolleginnen und Kollegen! 
Ich möchte namens unserer Fraktion beantragen, die Ple-
narsitzung für die Dauer von zunächst 30 Minuten zu 
unterbrechen, damit wir eine Fraktionssitzung machen 
können. Deswegen bitte ich aus diesem Grund nach stän-diger Übung des Hauses, dieses auch entsprechend zu 
genehmigen.
Vielen Dank.Deutscher Bundestag – 20. Wahlperiode – 211. Sitzung. Berlin, Freitag, den 31. Januar 2025                                 27514 
(A) 
(B) (C) 
(D) Präsidentin Bärbel Bas"
"
Friedrich Merz",CDU/CSU,"Frau Präsidentin! Liebe Kolleginnen und Kollegen! 
Am Mittwoch hat es hier im Deutschen Bundestag eine 
Abstimmung über einen Entschließungsantrag meiner Fraktion gegeben, der mit den Stimmen der CDU/CSU, der FDP, der AfD und einiger fraktionsloser Abgeord -
neten eine Mehrheit gefunden hat.

Dieser Entschließungsantrag ist und bleibt in der Sache richtig.

In der politischen Auseinandersetzung dieser Tage, 
meine Damen und Herren, geht es aber nicht um den Inhalt dieses Entschließungsantrages,
(Widerspruch bei der SPD und dem BÜND-
NIS 90/DIE GRÜNEN – Jürgen Coße [SPD]: 
Es geht um Ihre Glaubwürdigkeit!)sondern allein um die Bedingungen, unter denen er zu-
stande gekommen ist.

Im Zusammenhang mit dieser Abstimmung, meine Da-
men und Herren, ist von Ihnen, den Sozialdemokraten und den Grünen, aus diesem Abstimmungsergebnis eine Zusammenarbeit der CDU/CSU mit der AfD konstruiert 
worden.
(Dirk-Ulrich Mende [SPD]: Genau das ist es 
doch auch! – Gegenruf von der CDU/CSU: 
Hören Sie zu!)
– Ihre Zwischenrufe belegen, dass Sie genau das denken.
Herr Kollege Mützenich, Sie haben mich offensicht-
lich in Ihrer Fraktionssitzung heute Morgen schon einmal aufgefordert, mich dafür zu entschuldigen, dass ich der 
AfD die Hand gereicht habe.

Meine Damen und Herren, ich will hier ganz nüchtern, sachlich und ruhig feststellen: Von meiner Partei aus reicht niemand der AfD die Hand – niemand!

Diese Partei ist eine in großen Teilen rechtsextreme 
Partei. Diese Partei untergräbt das Fundament unserer Demokratie.
(Saskia Esken [SPD]: Ja, mit Ihrer Hilfe! – 
Weitere Zurufe von der SPD)
Und Sie müssten eigentlich, wenn Sie ruhig hinschauen, erkennen, dass nicht Sie von der SPD oder Sie von den 
Grünen oder Sie von der FDP, sondern wir als politische Partei diejenigen sind, gegen die sich der Furor dieser 
sogenannten Alternative für Deutschland am allermeisten 
richtet.
(Saskia Esken [SPD]: Die demokratischen 
Einrichtungen, Herr Merz!)
Sie will die CDU vernichten. Meine Damen und Herren, Sie glauben doch wohl nicht im Ernst, dass wir einer Partei die Hand reichen, die uns vernichten will.

Es gibt keine tieferen Gräben in diesem Parlament als zwischen uns und dieser Fraktion.
Nun stehen wir heute möglicherweise vor einer weite-
ren Abstimmung. Aber warum sind wir eigentlich heute hier? Warum diskutieren wir eigentlich über ein Gesetz zur Begrenzung des Zustroms in die Bundesrepublik 
Deutschland?
Deutscher Bundestag – 20. Wahlperiode – 211. Sitzung. Berlin, Freitag, den 31. Januar 2025                                                                                                                                                                                                27517 
(A) 
(B) (C) 
(D) Dr. Rolf Mützenich 
Herr Kollege Mützenich, es ist auffallend gewesen in"
"
Friedrich Merz",CDU/CSU,"Nein. – Ich werde mit meiner Partei und meiner Bun-
destagsfraktion in den nächsten Wochen und Monaten 
und, wenn es notwendig ist, Jahren alles tun, damit diese 
Partei nicht weiter wächst
(Unruhe bei der SPD – Dr. Johannes Fechner 
[SPD]: Das glaubt Ihnen keiner!)
und sie möglichst bald wieder eine Randerscheinung im 
politischen Spektrum der Bundesrepublik Deutschland wird – da, wo sie nach meiner festen Überzeugung hin -
gehört. Da gehört sie hin, meine Damen und Herren.

Aber die Menschen draußen, die uns in diesen beweg-
ten Tagen zuhören und zuschauen, die wollen nicht, dass wir hier untereinander Streit über die AfD austragen.Deutscher Bundestag – 20. Wahlperiode – 211. Sitzung. Berlin, Freitag, den 31. Januar 2025                                                                                                                                                                                                27519 
(A) 
(B) (C) 
(D) Friedrich Merz 
(Lachen bei Abgeordneten der SPD)
Die wollen, dass wir zu Lösungen kommen in den Fra-
gen, die den Lebensalltag der Menschen Tag für Tag betreffen und sie beschäftigen. Und wir wollen vor allen 
Dingen, dass wir zu Lösungen kommen, dass sich die 
Menschen in unserem Lande wieder sicher fühlen kön-nen.

Das ist der wichtigste Auftrag, den wir als Parlamentarier in dieser innenpolitischen Debatte für unser Land haben, 
meine Damen und Herren.
Und deswegen ist mein Schlusssatz. Wenn Sie das 
machen wollen, so wie Sie, Herr Kollege Mützenich, das hier angekündigt haben, dann ist das Ihr gutes Recht, 
das zu tun. Das ist eine demokratisch legitime Art und Weise der Auseinandersetzung, auch bei einer Bundes -
tagswahl. Ich sage Ihnen nur von meiner Seite und für 
meine Bundestagsfraktion: Wir werden uns auf die Men-
schen und auf ihre Sorgen konzentrieren, wir werden ver-suchen, sie aufzunehmen, und wir werden versuchen, 
ihnen auch hier im Deutschen Bundestag Recht und 
Stimme zu geben, damit die Menschen das berechtigte Gefühl haben, dass dies ein Parlament ist,

in dem die Sorgen und Nöte der Menschen ernst genom-men werden und in angemessener Zeit auch die gesetzli-
chen Entscheidungen getroffen werden,
(Andrea Lindholz [CDU/CSU]: Genau so ist 
es!)
damit es in diesem Lande wieder besser wird

und nicht jede Woche und jeden Monat schwieriger, pro-
blematischer und konfliktreicher. Das ist das, was mich antreibt, was uns antreibt.
(Saskia Esken [SPD]: Wenn das so wäre, dann hätten Sie dem Sicherheitspaket zugestimmt! Das tun Sie nicht!)
Wenn Sie diese Auseinandersetzung wollen, dann tra-
gen wir sie miteinander aus. Aber ich gebe Ihnen eines zu bedenken: Es gibt nicht nur den 23. Februar,

es gibt auch den 24. Februar. Und dann müssen wir mit-einander gesprächsfähig sein und bleiben.
(Lachen bei Abgeordneten der SPD – Lachen bei Abgeordneten der AfD – Beatrix von Storch [AfD]: Viel Glück! – Saskia Esken [SPD]: Vogel, friss und stirb!)
Wir müssen es sein und bleiben! Aber, meine Damen und Herren, bis dahin entscheiden Sie mit Ihrer Minderheit nicht darüber, welche Gesetzentwürfe hier im Deutschen 
Bundestag zur Abstimmung kommen. Das entscheiden 
Sie nicht, meine Damen und Herren,
insbesondere dann nicht, wenn wir an einem solchen Punkt stehen, mit einem solchen Gesetzentwurf eine 
kleine Antwort zu versuchen zu geben auf das große 
Problem, das unser Land beschwert, das die Menschen beschwert und das unsere Demokratie zu zerreißen droht, wenn wir uns als entscheidungsunfähig erweisen,

selbst in einer so kritischen Phase hier die notwendigen gesetzgeberischen Schritte zu unternehmen.
Ich danke Ihnen.
(Anhaltender Beifall bei der CDU/CSU sowie bei Abgeordneten der FDP – Die Abgeord-
neten der CDU/CSU erheben sich – Rasha 
Nasr [SPD]: Sie haben die Demokratie am Mittwoch verraten! – Weitere Zurufe von der SPD)"
"
Friedrich Merz",CDU/CSU,"Herr Kollege Banaszak, ich weiß nicht, ob Sie in den 
letzten Tagen, Wochen und Monaten irgendwann mal die Zeitungen gelesen haben.
(Heiterkeit und Beifall bei Abgeordneten der CDU/CSU – Dorothee Bär [CDU/CSU]: Nee! Nee!)
Wenn Sie das getan hätten, wäre eine solche Frage von Ihnen völlig überflüssig gewesen.

Ich denke überhaupt nicht daran, mich auf dieses Niveau in einer solchen Debatte hier einzulassen.
(Dorothee Bär [CDU/CSU]: Schülerpar-lament! – Felix Banaszak [BÜNDNIS 90/DIE GRÜNEN]: Ja oder nein?)
Die Antwort von mir ist jederzeit klar gewesen, und die 
ist und bleibt klar.
(Katja Mast [SPD]: So wie „Keine Mehrheit 
mit der AfD!“?)
Die Antwort ist, dass wir uns von dieser Fraktion hier rechts nicht in eine Mehrheit oder in eine Bundesregie-rung bringen lassen.
(Lachen bei Abgeordneten der AfD – 
Dr. Bernd Baumann [AfD]: Herr Nehammer!)
Das ist und bleibt klar. Und auch mit solchen Suggestiv-fragen, wie Sie sie hier stellen, ändert sich daran gar 
nichts, Herr Kollege."
"
Alexander Hoffmann",CDU/CSU,"Frau Ministerin, vielen Dank, dass Sie die Zwischen-
frage zulassen. – Ich bin deswegen dankbar, weil es da für 
mich persönlich um einen ganz wichtigen Punkt geht. Sie 
haben ja gerade noch mal zusammengestellt, was für 
Überlegungen die AfD zusammenträgt in Bezug auf Menschen mit Migrationshintergrund in unserem Land."
"
Thorsten Frei",CDU/CSU,"Frau Bundesaußenministerin, es ist schlimm genug, 
dass Sie hier eine völlig faktenfreie Rede halten.

Es ist aber absolut inakzeptabel, dass Sie hier vor dem 
versammelten Deutschen Bundestag Lügengeschichten 
erzählen. Lügengeschichten!

Wir haben uns Anfang September zweimal für jeweils 
mehrere Stunden getroffen, um die Frage zu beraten, ob 
es gelingen kann, jenseits unserer Zusammenarbeit hier 
im Deutschen Bundestag einen echten Schritt hin zu mehr Sicherheit in Deutschland und zu einer besseren Kon -
trolle der Migration zu erreichen. Meine Wahrnehmung, 
die Wahrnehmung meiner Kolleginnen und Kollegen 
war, dass die FDP dazu bereit war.

Meine Wahrnehmung war, dass die SPD die Herausfor-derungen erkannt hat. Und meine Wahrnehmung war,
(Katharina Dröge [BÜNDNIS 90/DIE GRÜ-
NEN]: Eine selektive Wahrnehmung!)
dass – ich will das ganz persönlich machen – unter den grünen Verhandlungsteilnehmern insbesondere Sie völlig unwillig waren, auch nur den kleinsten Schritt hin zu 
Begrenzung, Ordnung und Steuerung von Migration in 
Deutschland zu ermöglichen.

Ich will das auf einen Punkt begrenzen. Wir haben über 
etwas gesprochen, von dem wir überzeugt sind, dass es 
rechtlich nicht nur möglich, sondern sogar geboten ist. 
Ich akzeptiere aber, wenn man eine andere Rechtsauffas -
sung hat. Darum haben wir Sie, Frau Baerbock, auch ganz persönlich gefragt – wir haben Ihnen unsere Vor-
stellungen selbstverständlich in extenso erläutert –: Sind 
Sie bereit, die Dinge, die sofort zu einer Begrenzung führen, die rechtlich überhaupt nicht umstritten sind, son-
dern nur einer politischen Entscheidung bedürfen, tat-
sächlich mit uns zu unternehmen?
(Britta Haßelmann [BÜNDNIS 90/DIE GRÜ-
NEN]: Welche denn?)Deutscher Bundestag – 20. Wahlperiode – 211. Sitzung. Berlin, Freitag, den 31. Januar 2025                                                                                                                                                                                                27525 
(A) 
(B) (C) 
(D) Vizepräsidentin Katrin Göring-Eckardt 
Es ging beispielsweise um die Beendigung von Bundes-
aufnahmeprogrammen, von freiwilligen Aufnahmepro-
grammen. Darüber können Sie als Bundesregierung ent-scheiden.

Auch die Reduzierung des Familiennachzugs kann man machen, wenn man es will. Die Rechtslage ist da sehr klar und eindeutig."
"
Markus Frohnmaier",AfD,"Liebe Außenministerin Frau Baerbock, glauben Sie, 
dass die Bürger, die heute diese Debatte verfolgen, nach-
vollziehen können, dass der Deutsche Bundestag mit 
Ernsthaftigkeit und auch mit einem Verständnis darauf blickt, was sich eigentlich zugetragen hat in den letzten 
Wochen? Alles, was wir hier gerade sehen, ist viel Auf -
geregtheit und Empörung. Dabei geht es offenbar diesen 
Parteien, auch Ihrer Partei, nicht darum, die Probleme in 
Deutschland zu lösen, die von der Union, von Friedrich 
Merz und seiner Partei, mit der Grenzöffnung verursacht worden sind. Vielmehr ist alles, was wir hier diese Woche erlebt haben, eigentlich – Entschuldigung – eine Debatte 
darüber, ob es im Deutschen Bundestag gute demokrati -
sche Stimmen oder weniger gute demokratische Stimmen 
gibt.

Wissen Sie, das, was Sie hier diese Woche veranstaltet 
haben, das ist wirklich schändlich. Wir müssen den Bür-gern da draußen Lösungen dafür anbieten, dass das, was 
sich in Aschaffenburg zugetragen hat, in Deutschland 
nicht wieder passiert. Es gibt nur eine Partei, die diese Woche gezeigt hat, dass sie dazu in der Lage ist, diese Probleme anzupacken – mit Besonnenheit, mit Lösungen,

mit Ideen. Und das ist die AfD. Alle anderen Kräfte hier im Haus haben politische Ränkespiele ausgetragen, und Sie, Frau Außenministerin, Sie haben sich genauso damit 
gemein gemacht. In einer Demokratie hat jede Stimme 
denselben Wert. Darüber zu diskutieren,(Saskia Esken [SPD]: Ihr seid Antidemokra-
ten!)
nachdem Menschen zu Tode gekommen sind, ob AfD- Stimmen mehr Wert haben als die der Union oder die der Grünen, das wird doch der Sache absolut nicht gerecht. Ich muss Ihnen ganz ehrlich sagen:"
"
Markus Frohnmaier",AfD,"Denken Sie auch mal an die Eltern, an die Eltern der 
Opfer, die sich abends in den Schlaf weinen!"
"
Markus Frohnmaier",AfD,"Was Sie hier diese Woche veranstaltet haben, das ist 
wirklich eine Schande."
"
Wolfgang Kubicki",FDP,"Frau Präsidentin! Liebe Kolleginnen und Kollegen! 
Ich bin mir nicht ganz sicher, ob wir alle gut beraten sind, 
angesichts der Frage, wie wir die Migration steuern kön-
nen, permanent eine Anti-AfD-Debatte zu führen. Ich bin mir nicht sicher.

Ich bin vor 54 Jahren in die FDP eingetreten und habe 
schon Wahlkampf für Willy Brandt und Walter Scheel gemacht, als viele von denen, die hier im Saal sitzen, noch nicht einmal geboren waren. Und auch ich bin da -
mals für „… mehr Demokratie wagen“ eingetreten. Ich war 1990 Abgeordneter des ersten freigewählten gesamt-deutschen Parlaments seit 1933, das Willy Brandt als 
Alterspräsident eröffnet hat, nachdem mutige Menschen 
in der DDR für Demokratie und Freiheit aufgestanden sind. Ich habe 25 Jahre als Vorsitzender einer Landtags -
fraktion meinem Land gedient und die Institutionen un-
seres Staates in den 90er-Jahren schon gegen die DVU 
verteidigt und gemeinsam mit Ralf Stegner dafür gesorgt,
(Dr. Bernd Baumann [AfD]: Um Gottes wil-
len!)
dass die AfD wieder aus dem Schleswig-Holsteinischen 
Landtag verschwunden ist.

Ich wurde 2019 für meinen jahrzehntelangen Einsatz 
für den Rechtsstaat und die Demokratie vom Bundesprä-
sidenten mit dem Bundesverdienstkreuz ausgezeichnet. 
Und jetzt muss ich mir von einer V orfeldorganisation 
der regierungstragenden Grünen sagen lassen, ich würde einer Initiative zustimmen, die rechtsextrem, rassistisch 
und demokratiefeindlich ist, und ich würde dem Faschis-
mus Tür und Tor öffnen.
Gleichzeitig muss ich mir von der Vorsitzenden der 
Grünenfraktion sagen lassen, meine Partei stünde rechts 
der AfD. Was soll das eigentlich heißen, liebe Kollegin Haßelmann? Ist die AfD für Sie gesprächsfähiger als wir? 
Was soll das heißen?

Wenn sich jemand entschuldigen muss, dann Frau Haßelmann bei meiner Partei.

Liebe Grüne, wer politische Mitbewerber auf diese 
Weise abqualifiziert, die ihre parlamentarische Pflicht 
erfüllen und in der Sache einer politischen Initiative 
ihre Zustimmung geben, der sollte sich in Fragen der Moral besser zurückhalten.

Und ich finde, eine Partei, bei der die Unschuldsver-mutung in eine Schuldvermutung umgekehrt wird, sollte 
sich insgesamt mit Belehrungen zurückhalten.

Wenn wir jetzt erleben, dass CDU-Zentralen be-
schmiert werden und die Polizei Veranstaltungen mit CDU- und FDP-Beteiligung schützen muss, frage ich"
"
Wolfgang Kubicki",FDP,"Ich lasse mich darauf nicht ein. Ich stimme in der 
Sache, wie ich das für richtig halte, und auch meine Fraktion lässt sich darauf nicht ein. Wir werden in der 
Sache zustimmen.
Vielen Dank.
(Langanhaltender Beifall bei der FDP und der CDU/CSU sowie bei Abgeordneten der AfD – 
Die Abgeordneten der FDP-Fraktion erheben sich – Abgeordnete der CDU/CSU-Fraktion 
erheben sich)"
"
Alexander Dobrindt",CDU/CSU,"Frau Präsidentin! Sehr geehrte Damen und Herren! 
Frau Bundesministerin Faeser, offensichtlich sind Sie 
aus Ihrer Fraktion von Ihrem Fraktionsvorsitzenden voll-kommen falsch informiert worden. Wir haben heute aktiv 
angeboten, unser Gesetz zu beraten, zu erweitern, zu er-
gänzen und neu vorzustellen. Sie waren nicht bereit dazu, dieses Gesetz neu zu beraten und vorzustellen.

Sie waren nicht bereit dazu. Sie waren nicht bereit dazu, 
weil Sie keine Bereitschaft haben, die Begrenzung durch-zusetzen, weil Sie keine Bereitschaft haben, den Famili-
ennachzug einzuschränken,
(Saskia Esken [SPD]: Lüge!)
weil Sie keine Bereitschaft haben, der Bundespolizei mehr Kompetenzen zu geben. Wir haben alles im Detail 
nachgefragt.
(Saskia Esken [SPD]: Lüge!)
Sie haben keine Bereitschaft dazu gehabt.

Frau Baerbock, Sie sprechen hier von einer Zäsur. Ja, 
in der Tat, eine Zäsur hat stattgefunden, und zwar spätes-tens am 22. Januar um 11.45 Uhr in Aschaffenburg. Ich will Ihnen aus dem Bericht etwas vorlesen, damit wir 
wissen, warum wir heute hier stehen:
Der Tatverdächtige zog einem im Bollerwagen sitzen-
den zweijährigen deutschen Jungen marokkanischer Her-kunft die Mütze und den Schal aus und stach ohne weitere 
Vorankündigung mit einem 32 Zentimeter langen Kü-chenmesser mehrfach auf den Hals- und Schulterbereich 
des Jungen ein.
(Susanne Menge [BÜNDNIS 90/DIE GRÜ-NEN]: Was sagen Sie eigentlich den Eltern? 
Was ist das für eine erbärmliche Show hier!)
Der Junge wurde hierdurch tödlich verletzt. Anschlie-ßend wandte er sich einem weiteren Kind, einem zwei-
jährigen syrischen Mädchen, zu und verletzte dieses 
durch Messerstiche im Halsbereich schwer.
(Dr. Bernd Baumann [AfD]: Unter Ihrer Re-
gierung eingewandert! Unkontrolliert!)
Ich erspare Ihnen die weiteren Teile des Berichts, wie 
er den 41-jährigen Helfer ermordet hat. – Aber Ihre Zwi-
schenrufe gerade – jeder konnte das hören –,

das ist Ihr Respekt, den Sie der Öffentlichkeit schreiend 
entgegentönen. Das ist Ihr Respekt, genau der.
Deutscher Bundestag – 20. Wahlperiode – 211. Sitzung. Berlin, Freitag, den 31. Januar 2025                                 27532 
(A) 
(B) (C) 
(D) Bundesministerin Nancy Faeser 
Herr Mützenich, ich hätte erwartet, dass Sie zumindest 
an einer Stelle mal erwähnen, warum wir heute hier sit-
zen – nach Solingen, nach Magdeburg, nach Aschaffen-burg –, was die Ursache für unser Zustrombegrenzungs-
gesetz ist. Aber nein, Sie erzählen, Sie wollen etwas 
gegen rechts unternehmen, Sie wollen gegen rechts außen kämpfen. Ich glaube Ihnen das sogar. Aber das Lebens -
elixier von rechts außen, das ist die ungelöste Migrations-frage, das sind die Sicherheitsfragen, die steigende Angst. Sie tun dagegen nichts.

Stattdessen haben Sie eine spalterische Rede gehalten, Herr Mützenich. Ja, Sie haben die Argumente durch Vor-
würfe, durch Anwürfe ersetzt. Sie haben das Problemlö-
sen durch Polarisierung ersetzt. Sie haben die Sicherheit durch Spaltung ersetzt. Das ist das Ergebnis Ihrer Rede.

Ich gebe Ihnen auch ein Zitat mit, ein Zitat eines So-
zialdemokraten:
„Wenn wir uns weiterhin einer Steuerung des Asyl-problems versagen, dann werden wir eines Tages von den Wählern, auch unseren eigenen, weggefegt, 
....“"
"
Alexander Dobrindt",CDU/CSU,"So spaltet die Restampel die Gesellschaft. – Das war 
Ihre grüne Kollegin gestern."
"
Alexander Dobrindt",CDU/CSU,Ja.
"
Alexander Dobrindt",CDU/CSU,"Sehr geehrter Herr Mützenich – letzter Satz –, Sie 
haben von der Hölle gesprochen. Wenn Sie es hier schon 
mit Himmel und Hölle so ernst nehmen, –"
"
Alexander Dobrindt",CDU/CSU,– dann gebe ich Ihnen Jakobus mit auf den Weg:
"
Alexander Dobrindt",CDU/CSU,"„Wer also das Richtige tun kann und es nicht tut, der 
sündigt.“
Danke schön."
"
Alexander Dobrindt",CDU/CSU,"Lieber Kollege Mützenich, wir haben über viele Stun-
den heute zusammengesessen. Ich weiß nicht, ob wir 
gleiche Erinnerungen daran haben.
(Lachen bei Abgeordneten der SPD)"
