name,party,speech
"
Manuel Höferlin",FDP,"Sehr geehrte Frau Präsidentin! Meine lieben Kollegin-
nen und Kollegen! Die schrecklichen Anschläge in Mag-
deburg und Aschaffenburg haben alle erschüttert. Es sind 
Angriffe, die uns sprachlos zurücklassen. Es sind aber 
nicht nur Angriffe auf die Menschen, die dort unmittelbar betroffen sind, sondern es sind immer auch Angriffe auf 
unser aller Sicherheit, auf das friedliche Zusammenleben,
(Andrea Lindholz [CDU/CSU]: So ist es!)
weil sich die Menschen – das ist mehrfach gesagt wor-
den – natürlich darüber Gedanken machen: Trifft es das 
nächste Mal vielleicht mich? Bin ich in einem sicheren 
Land?
Und doch muss man feststellen, dass solche Taten im-
mer einem gewissen Szenario folgen. Franz Josef Strauß 
hat das einst treffend beschrieben: Nach dem schreck-
lichen Verbrechen folgen Bestürzung und Empörung, der Ruf nach harten Maßnahmen, die Warnung vor Über-
reaktionen, oft dann gar nichts und danach wieder der 
Übergang zur Tagesordnung.
(Mike Moncsek [AfD]: Und Selfies der Grü-
nen!)
1) Anlage 11Deutscher Bundestag – 20. Wahlperiode – 211. Sitzung. Berlin, Freitag, den 31. Januar 2025                                 27604 
(A) 
(B) (C) 
(D) Moritz Oppelt 
Das darf nicht weiter passieren. Die Menschen haben den 
Eindruck, dass wir hier immer wieder Dinge feststellen, 
analysieren, Maßnahmen welcher Art auch immer per Gesetz beschließen, sich aber am Ende im Ergebnis 
nichts ändert.
Ich habe gestern hier an dieser Stelle schon mal gesagt, 
wie ich das empfinde und was für ein Eindruck hinterlas-sen wird, wofür wir hier im politischen Raum primär 
stehen, wenn ich im Innenausschuss wieder von Behör-denchefs, von politisch Verantwortlichen höre, dass sie sich in ihrem Bereich erst mal nichts vorzuwerfen haben.
(Andrea Lindholz [CDU/CSU]: Genau!)
Meine Damen und Herren, wenn wir im Innenaus-
schuss zum Beispiel zu Aschaffenburg hören, dass in Bayern nichts schiefgegangen ist, dass auf der anderen Seite im BAMF nichts schiefgegangen ist,
(Andrea Lindholz [CDU/CSU]: Das hat er 
doch gar nicht gesagt!)
dann ist klar: Die Menschen können uns das doch nicht glauben. Die stellen sich zu Recht die Frage: Was ist denn 
da schiefgegangen? Und wie können wir das in Zukunft 
besser machen?
Der Täter von Magdeburg war bei zig Behörden be-
kannt. Der Täter von Aschaffenburg hätte gar nicht mehr hier sein dürfen.
(Andrea Lindholz [CDU/CSU]: Ja, eben!)
Wir stellen das schon lange fest – übrigens auch beim Anschlag vom Breitscheidplatz, den Sie vorhin genannt haben, Frau Kollegin, bei dem wir gesagt haben: was ist 
denn das Problem? –, und wir sprechen immer darüber: 
Es liegen oft Erkenntnisse vor. Es gibt keinen Mangel an Gesetzen. Es gibt keinen Mangel an Kenntnissen über 
Personen. Es gibt auch keinen Mangel an Befugnissen, 
sondern es gibt in den allermeisten Fällen einen Mangel an Kommunikation, an Zusammenarbeit und an Verant -
wortungsübernahme.

Ich war am Mittwoch erschrocken, als berichtet wurde, 
dass eine Stelle einer anderen Behörde eine Meldung weiterleitet,
(Beatrix von Storch [AfD]: Es sind zu viele 
Meldungen!)
und ich den Eindruck hatte: Mit dieser Meldung ist der 
Fall für diese Behörde abgeschlossen.
(Andrea Lindholz [CDU/CSU]: Das ist doch 
gar nicht richtig!)
Es wird nicht nachgefragt. Es gibt auch keine Rückmel-deschleife. – Das macht die Menschen fassungslos.
(Beatrix von Storch [AfD]: Es sind zu viele, Herr Höferlin! Sagen Sie doch mal was dazu! – Stephan Brandner [AfD]: Vielleicht lähmt auch 
Strack-Zimmermann den Polizeiapparat so ein 
bisschen!)Deswegen sagen wir als Freie Demokraten immer wie-
der – und wir hören damit auch nicht auf –: In diesem Land, in dem die Sicherheit zwischen Bund, Ländern und auch immer mehr den Ordnungsämtern in den Kom -
munen verteilt ist, brauchen wir eine Reform der inneren Sicherheit, eine Föderalismusreform, die sich diesen Auf-gaben zuwendet, die klare Zuständigkeiten und vor allen 
Dingen klare Kommunikationswege und Verantwortlich-
keiten definiert, damit wir in Zukunft unsere Lehren da-raus ziehen können, meine Damen und Herren.

Wir haben an dieser Stelle oft darüber gesprochen, dass 
sich Dinge ändern müssen. Das eine ist die Sicherheit und die Organisation der Sicherheit.
(Stephan Brandner [AfD]: Da hätten Sie heute 
zustimmen können! Wo waren Sie denn?)
Das andere ist die Frage, wie wir in Zukunft dafür sorgen, 
dass Menschen, die hier Schutz suchen, auch Schutz be-kommen und in Sicherheit leben können, nämlich indem 
die Menschen, die hier für Unsicherheit sorgen und sich 
nicht an unser Gesetz halten, auch wieder gehen müssen. Das ist der zweite Teil, der genauso wichtig ist. Diese 
beiden Aufgaben sind drängend, und die Menschen er -
warten von uns, dass wir sie lösen.

Ich halte jetzt hier – Frau Präsidentin, es tut mir leid, 
dass auch ich damit anfangen muss – meine wahrschein-lich wirklich letzte Rede. Das ist jetzt die fünfte letzte 
Rede, die ich halte, weil ich nicht wusste, dass es an verschiedenen Stellen noch so viel zu sagen gibt.
(Mike Moncsek [AfD]: Gehen Sie zu Ihrer 
letzten Abstimmung! Das wäre besser gewe-
sen!)
Ich habe 2009 hier das erste Mal im Bundestag ein 
Mandat angetreten. Vor 5 455 Tagen habe ich meine erste Rede zur Gründung des IT-Planungsrats gehalten; man vergisst seine erste Rede nie. Es war mir eine Ehre, hier 
zu sein. Es war mir eine Freude, mit vielen von Ihnen, 
liebe Kollegen, zusammenzuarbeiten."
"
Thomas Seitz",fraktionslos,"Sehr geehrte Frau Präsidentin! Meine Damen und Her-
ren! Die Hintergründe der Gewalttaten sind eindeutig: Es sind die Toten von Merkel, aber auch von Scholz und 
Habeck. Das Blut klebt auch an den Händen der Abge-
ordneten, die gegen die Preisgabe unserer Grenzen 2015 nicht rebelliert haben,
(Andrea Lindholz [CDU/CSU]: Das ist ja ge-nauso unterirdisch! Mein Gott! – Stephan Brandner [AfD]: Drei Viertel von der CDU 
zum Beispiel!)
weil die Karriere wichtiger war als der Schutz unseres 
Landes, wie bei Herrn Spahn, der unter Kanzlerin Merkel 
erst Staatssekretär und dann Minister war und heute in 
Migrationsfragen den Hardliner spielt. Und das Blut klebt an den Händen all derer, die fast jeden illegalen Migran -
ten auch noch bejubeln, wie so viele Linke, Rote und Grüne. Allerdings bestimmt das Thema nur wegen der Bundestagswahl die Schlagzeilen.
(Andrea Lindholz [CDU/CSU]: Wo ist denn 
der Herr Seitz heute unterwegs?)
Denn sonst hätten schon die Silvesternacht 2015, das Attentat auf den Breitscheidplatz 2016 oder die unzäh-
ligen Gewalt- und Sexualdelikte krimineller Migranten 
seit 2015 zu den notwendigen Konsequenzen geführt.
(Andrea Lindholz [CDU/CSU]: O Gott! – 
Stephan Brandner [AfD]: Knapp zehn Jahre 
hat die CDU gepennt! Alles mitgemacht!)
Insoweit sei nur an den Mord an Susanna Feldmann er-
innert.
Der Staat muss kontrollieren und auswählen können, 
wer zu uns kommen darf, oder er wird zum Instrument der Unterdrückung der Bevölkerung, zu der natürlich 
auch integrierte, rechtstreue Migranten und deren Nach -Deutscher Bundestag – 20. Wahlperiode – 211. Sitzung. Berlin, Freitag, den 31. Januar 2025                                 27608 
(A) 
(B) (C) 
(D) Dr. Ralf Stegner 
fahren gehören. Denn deren Sicherheit und hart erarbei-
teter Wohlstand werden genauso geopfert wie die von 
allen anderen Bürgern.
Eine solche Migrantin arbeitet übrigens in meinem 
Büro. Ihre Wiege stand in Afghanistan. Man sieht es ihr an, und ihr Name klingt so; aber sie ist eine bessere Deutsche als mein Vorredner Herr Stegner."
"
Andrea Lindholz",CDU/CSU,"Sehr geehrte Frau Präsidentin! Meine sehr geehrten 
Damen und Herren! Liebe Kolleginnen und Kollegen! Nach dieser Woche, nach diesem Tag war ich nicht 
ganz sicher, wie ich heute meine Rede beginnen soll. Es 
ist ja auch nicht so einfach, Aschaffenburg hier an diesem Abend noch als letzten Tagesordnungspunkt aufzurufen. 
Lieber Kollege Niklas Wagener, der Sie auch aus Aschaf -
fenburg kommen, ich habe mich entschieden, alle ein 
Stück weit mit nach Aschaffenburg zu nehmen.
(Canan Bayram [BÜNDNIS 90/DIE GRÜ-
NEN]: Ja, bitte!)"
"
Andrea Lindholz",CDU/CSU,"Man muss es verstehen, es in seiner Gänze mal gehört 
haben. Fragen wir uns alle, was das mit unserer Gesell-
schaft und uns macht. Ich möchte nicht, dass diese Zu-
stände in unserem Land so zunehmen und Frauen Angst haben, auf die Straße zu gehen.
(Canan Bayram [BÜNDNIS 90/DIE GRÜ-
NEN]: Das wollen wir alle nicht!)
Lassen Sie uns etwas tun!"
"
Nils Gründer",FDP,"Die verheerenden Anschläge von Mannheim, Solin-
gen, Magdeburg und Aschaffenburg machen mich betrof-
fen und fassungslos. Ich teile die Forderung nach einer 
entschlossenen Reaktion – denn wie es ist, kann es nicht bleiben. Aus diesem Grund unterstütze ich die Forderung 
nach mehr Ordnung in der Migrationspolitik.
Gleichzeitig empört mich das Verhalten der Fraktionen 
von SPD und Bündnis 90/Die Grünen. Ihre Verweige-
rungshaltung, den dringenden Handlungsbedarf in der Migrationspolitik anzuerkennen, hat überhaupt erst zu 
dieser Situation geführt. Die Reaktion nach dem abscheu-lichen Attentat in Aschaffenburg, insbesondere aufseiten 
von Bündnis 90/Die Grünen, ist entlarvend. Anstatt sich 
zwischen den demokratischen Fraktionen auf sinnvolle Maßnahmen zu verständigen, besteht ihre einzige 
Agenda offenbar in der Erhaltung des Status quo.
Grundsätzlich braucht es eine europäische Lösung in 
der Asyl- und Migrationspolitik. Einerseits müssen die 
EU-Außengrenzen konsequent geschützt und kontrolliert 
werden, andererseits dürfen wir die Freizügigkeit inner -
halb der EU nicht aufs Spiel setzen. Im Rahmen dieser 
EU-Regelungen braucht es feste Verteilquoten sowie ein 
Asylverfahren außerhalb der EU-Außengrenzen. Ein 
Wegducken anderer europäischer Staaten darf es nicht geben. Solange die europäische Asyl- und Migrations -
politik derart reformbedürftig bleibt, begrüße ich natio-
nale Maßnahmen wie befristete Grenzkontrollen oder die 
Ausweitung von Befugnissen der Bundespolizei.
Dauerhafte und unbefristete Grenzkontrollen lehne ich 
ab. Davon profitieren insbesondere AfD und BSW, die unsere freiheitliche Demokratie und unsere Mitglied-schaft in der EU sowie der NATO, die uns seit Jahrzehn-ten Frieden und Wohlstand bringt, ablehnen. Insbeson-
dere in der Migrationspolitik möchte ich diesen Parteien 
keine Mitbestimmung zugestehen. Aus meiner Sicht darf es keine politische Mitbestimmung für Parteien geben, 
die sich als Patrioten bezeichnen, während sie im Inte -
resse fremder Mächte handeln.
Am vergangenen Mittwoch habe ich einem Entschlie-
ßungsantrag der CDU/CSU-Fraktion als Symbol zu-gestimmt, um meine Forderung nach einem Umdenken 
in der Migrationspolitik zu unterstreichen. Ich verwahre Deutscher Bundestag – 20. Wahlperiode – 211. Sitzung. Berlin, Freitag, den 31. Januar 2025                                 27614 
(A) 
(B) (C) 
(D) 
mich dagegen, mir von Gruppen oder Fraktionen – un-
abhängig von der politischen Ausrichtung – den Takt-
stock über mein Abstimmungsverhalten aus der Hand nehmen zu lassen. Einem Gesetzentwurf mit den Stim-
men von AfD und BSW zur Mehrheit zu verhelfen, kann 
ich mit meinem Gewissen jedoch nicht vereinbaren.
Aus diesem Grund enthalte ich mich bei der Abstim-
mung für den vorliegenden Gesetzentwurf."
"
Torsten Herbst",FDP,"Der unter der ehemaligen Bundeskanzlerin Angela 
Merkel beschlossene Richtungswechsel in der deutschen Migrationspolitik hat nicht nur unser Land gespalten, er hat Deutschland massiv geschadet. In der Folge verzeich -
nen wir eine massive Zuwanderung in das Sozialsystem, eine deutliche Verschlechterung der Sicherheitslage so-wie eine Gefährdung der Grundpfeiler unserer freiheitli-chen und liberalen Gesellschaft. Diese verfehlte Migrati-
onspolitik kostet Menschenleben, gefährdet die Freiheit 
von Frauen und sexuellen Minderheiten. Sie schüchtert jüdische Mitbürgerinnen und Mitbürger ein und bedroht 
ihr Leben. Sie hat auch eine rechtsradikale Partei groß 
gemacht. Die übergroße Mehrheit der Bevölkerung spricht sich daher für einen grundlegenden Richtungs -
wechsel in der Migrationspolitik aus. Konsequente Steuerung und Kontrolle statt Orientierungslosigkeit.
Heute steht im Deutschen Bundestag ein Gesetzent-
wurf der CDU/CSU-Fraktion zur Abstimmung, der im Wesentlichen auf Beschlüsse der Ministerpräsidenten-konferenz aufbaut, die bis heute nicht umgesetzt wurden. 
Es ist die Verantwortung der demokratischen Mitte des 
Landes – von CDU/CSU, SPD, Grünen und FDP –, die falsche Migrationspolitik zu korrigieren. Als Fraktion der 
Freien Demokraten haben wir heute den Weg zu einer 
gemeinsamen Verständigung aufgezeigt. Ich bedaure, dass dieser Weg keine Mehrheit im Deutschen Bundestag 
gefunden hat.
In der Sache stehe ich hinter den Inhalten des Gesetz-
entwurfs der CDU/CSU-Fraktion. Diese Inhalte entspre-
chen der Beschlusslage der Fraktion der Freien Demo-kraten im Deutschen Bundestag. Ich bin fest davon überzeugt, dass wir im Interesse unseres Landes Steue-
rung und Kontrolle in der Migrationspolitik zurück-
gewinnen müssen. Deshalb habe ich dem Gesetzentwurf zugestimmt.
Als gewählter Abgeordneter des Deutschen Bundes-
tages mache ich meine Zustimmung zu einem als richtig 
empfundenen Gesetzentwurf nicht vom möglichen Vo-
tum anderer Fraktionen abhängig. Wenn allein das mög-liche Votum anderer Fraktionen dazu führen würde, dass man die eigene, als richtig empfundene Haltung nicht 
mehr bei einer Abstimmung vertritt, nimmt die Demokra-
tie massiv Schaden. Ich habe daher aus tiefster Überzeu-gung für einen Richtungswechsel in der Migrationspoli-
tik gestimmt – und damit für eine Position, die von der 
übergroßen Mehrheit der Bevölkerung geteilt wird.Katja Hessel (FDP):
Am vergangenen Samstagnachmittag wurde erneut ein 
Mitbürger durch einen weiteren Messerangriff lebens-
gefährlich verletzt. Anstatt sich nach Aschaffenburg, So-lingen, Mannheim und Kiel ernsthaft mit konstruktiven 
Lösungen in der Migrationskrise zu befassen, vernebeln 
einige die politische Diskussion, indem sie diese An-einanderreihung abscheulicher Taten zu bloßen Einzel-
fällen herunterstilisieren.
Der vorliegende Gesetzentwurf setzt lediglich einen 
Beschluss der Ministerpräsidentenkonferenz um. Eine 
Zustimmung wäre daher auch für SPD und Bündnis 90/ Die Grünen möglich gewesen, um ein Zeichen zu setzen für eine Kehrtwende in der Migrationspolitik. Dabei zeigt 
die zunehmende Zahl der Messerattacken, dass die poli -
tische Linke, allen voran SPD und Grüne, mit ihrem An-
satz der Migrations- und Flüchtlingspolitik krachend an 
der Wirklichkeit gescheitert sind. Weil sie spüren, dass 
sich die gesellschaftliche Mehrheit in Deutschland eine konsequente und durchsetzungsstarke Gangart bei der 
Eindämmung irregulärer Migration wünscht, starten sie 
nun ein Ablenkungsmanöver nach dem anderen. Aber weder hilft dies in der Sachfrage der dringend notwendi -
gen Zurückdrängung irregulärer Migration weiter noch 
führt es dazu, den Rechtspopulisten den Wind aus den 
Segeln zu nehmen, deren Zustimmungswerte mit jeder Messerattacke nach oben zu schnellen scheinen.
Die politische Linke verliert sich in Brandmauer-De-
batten und bezichtigt Vertreter demokratischer Mitbewer-
ber als „Nazis“, ohne dabei eigene Lösungsvorschläge zu 
präsentieren. Indem SPD und Grüne die CDU/CSU von der Einbringung parlamentarischer Initiativen mittels 
moralischer Erpressung abbringen möchten, erweisen 
sie nicht nur der Lösung irregulärer Migration einen Bä -
rendienst, sondern auch dem demokratischen Parlamen-
tarismus der Bundesrepublik. In letzter Konsequenz 
würde dies dazu führen, dass in der Sache richtige Dinge aus der Mitte des Parlaments nicht mehr eingebracht werden können – und wir den Rändern von rechts und 
links die Gestaltung der Politik im Land überließen.
Dass es der deutsche Staat seit nunmehr zehn Jahren 
nicht geschafft hat, den problematischen Begleiterschei-
nungen irregulärer Migration Herr zu werden, hat doch 
den rechtsextremen Parteien erst einen Zuwachs von 
Wählerstimmen von unter 5 Prozent auf heute circa 
20 Prozent beschert. Wenn die demokratische Mitte keine Lösung für die Herausforderungen findet, werden die 
Ränder zwangsläufig an Zuspruch gewinnen; erst recht, 
wenn wir unser Stimmverhalten bereits heute von mögli -
chen Entscheidungen der AfD abhängig machen. Als li-
berale Mitte dürfen wir uns niemals in Geiselhaft von 
dieser im Kern radikalen und rechtsextremen Partei be-geben.
Die CDU/CSU-Bundestagsfraktion hat Anträge für ei-
nen Kurswechsel in der Migrations- und Flüchtlingspoli-
tik in den Deutschen Bundestag eingebracht. Auch wir 
Freie Demokraten haben in diesem Bereich in den ver-gangenen drei Jahren für einen Richtungswechsel ge-kämpft. Denn was dieses Land braucht, ist ein Umden-
ken: Wir müssen die irreguläre Migration mit 
Entschiedenheit zurückdrängen.Deutscher Bundestag – 20. Wahlperiode – 211. Sitzung. Berlin, Freitag, den 31. Januar 2025                                                                                                                                                                                                27615 
(A) 
(B) (C) 
(D) 
Ich stimme dem Entwurf des Zustrombegrenzungs-
gesetzes der CDU/CSU-Bundestagsfraktion zur Migrati-
onspolitik inhaltlich zu. Zu den innenpolitisch divergie-renden Ansichten halte ich es für sinnvoll, wenn die FDP- 
Bundestagsfraktion eigene Anträge einbringt.
Als gewählte Abgeordnete des Deutschen Bundestages 
halte ich dies für eine meiner Aufgaben, wenngleich ich 
nicht wie ein Minister explizit den Eid geschworen habe, 
Schaden vom eigenen Land abzuwenden. Daher ist für 
mich klar: Es bedarf einer gravierenden Wende bei der Eindämmung der irregulären Migration. Der Staat muss 
seiner Kernaufgabe nachkommen, für innere Sicherheit 
zu sorgen. Die Menschen in Deutschland müssen sich sicher fühlen können.
Mein heutiges Votum fällt mir nicht leicht, denn ich 
hätte mir eine Mehrheit in der Mitte des Hauses ge-
wünscht. Aber es kann nicht sein, dass wir im Deutschen Bundestag unsere Entscheidungen nicht an der Sache 
orientieren, sondern an denjenigen, die einem berechtig-
ten Anliegen zustimmen könnten. Dass es zu dieser Si-tuation gekommen ist, liegt daran, dass die restliche Re-
gierungskoalition nur noch daran interessiert ist, mit 
Empörung Wahlkampf zu machen und per Politikverwei-gerung diesem Empörungspotenzial Vorschub zu leisten. Sachentscheidungen im Bundestag dürfen aber nicht von 
sachfremden Erwägungen beeinflusst werden – weder 
von links noch von rechts.
Mit meiner FDP-Bundestagsfraktion habe ich mich 
heute dafür eingesetzt, die gesetzliche Grundlage für die Eingrenzung irregulärer Migration gemeinsam mit den Parteien der demokratischen Mitte zu stärken. Aufgrund in Teilen divergierender Ansichten haben wir Freie De -
mokraten den Fraktionen von SPD und Bündnis 90/Die Grünen heute angeboten, den Gesetzentwurf in den In-nenausschuss zu überweisen und dort aktiv mitzugestal-
ten. Meine Fraktion und ich standen bereit, diesen Pro-
zess konstruktiv zu begleiten."
"
Carina Konrad",FDP,"Ich stehe für eine konsequente, rechtsstaatliche Migra-
tionspolitik. Illegale Migration muss begrenzt, der Sozi-alstaat geschützt und unsere Grenzen müssen gesichert werden. Die Maßnahmen in diesem Gesetz sind inhaltlich richtig, sie entsprechen der Beschlusslage der FDP. Aber 
der Zeitpunkt und das Vorgehen der CDU sind falsch.
Wir befinden uns in einer Übergangszeit. Die Abstim-
mung heute findet 23 Tage vor der Bundestagswahl statt, in einer Phase, in der grundlegende Entscheidungen mit 
stabilen Mehrheiten getroffen werden müssen. Die Mi-grationspolitik neu zu ordnen, ist eine fundamentale Frage für unsere Gesellschaft. Es geht um Sicherheit, 
Ordnung und gesellschaftlichen Zusammenhalt. Das 
darf kein Wahlkampfmanöver sein.
Friedrich Merz hat sein Wort gebrochen. Er hat der 
deutschen Öffentlichkeit aus dem Reichstag heraus ver-
sprochen, dass er für solche Fragen stabile Mehrheiten statt Zufallsmehrheiten suchen wird. Heute verlässt er sich dennoch auf die Stimmen der AfD. Ohne Not. Das 
ist ein politischer Dammbruch und eine Gefahr für die 
politische Kultur in Deutschland.Dass dieses taktische Wahlkampfmanöver direkt aus 
dem schrecklichen Messerangriff von Aschaffenburg re-
sultiert, macht es noch verantwortungsloser. Ein Kind wurde ermordet, ein Mann, der schützend eingriff, getö-
tet, ein schrecklicher Angriff, der leider nicht zum ersten 
Mal zeigt, dass Handlungsbedarf besteht. Doch wer wirk-lich Sicherheit schaffen will, darf nicht nur auf den nächs-
ten Wahltag schielen, sondern muss langfristig und mit 
Verlässlichkeit handeln. Das geht nur mit stabilen Mehr-heiten, nicht mit Destabilisierung, nicht mit politischen Spielchen.
Ich werde mich an diesem Manöver nicht beteiligen. 
Als Freie Demokratin stehe ich für klare, rechtsstaatliche Lösungen, aber mit stabilen und verlässlichen Mehrhei-
ten. Ich möchte Deutschland nach der Wahl stabilisieren, 
nicht in einer Übergangszeit weiter destabilisieren.
Es ist die Aufgabe der CDU, ihr eigenes Gesetz mit 
stabilen Mehrheiten zu beschließen, ohne AfD. Das gilt 
bei einem Zustimmungsgesetz wie diesem auch für den Bundesrat.
Daher ist es richtig, dass die Freien Demokraten der 
CDU/CSU die Möglichkeit eröffnet haben, die Abstim-
mung zu vertagen, um Mehrheiten in der demokratischen Mitte für einen entschiedenen Richtungswechsel der Mi-
grationspolitik zu organisieren.
Weil es dazu heute nicht gekommen ist, habe ich mich 
in dieser Abstimmung enthalten. In der Sache stehe ich 
hinter den Maßnahmen – aber wenn es nicht um die Sache geht, sondern um ein taktisches Manöver, an des -
sen Ende die AfD jubelt, dann darf man sich nicht zum Spielball machen."
"
Ulrich Lechte",FDP,"Es ist sehr bedauerlich, dass die Bundestagsfraktionen 
CDU/CSU, SPD, FDP und Bündnis 90/Die Grünen nicht zu einer Einigung gelangen konnten. Inhaltlich entspricht dieser Antrag dem Beschluss der MPK vom 25. Oktober 
2024. Eine Zustimmung wäre mit der Mehrheit der de -
mokratischen Fraktionen für mich daher jederzeit mög-
lich gewesen. Aber der von der Fraktion der CDU/CSU 
eingebrachte Entwurf eines Zustrombegrenzungsgeset-
zes könnte nur mit den Stimmen der AfD eine Mehrheit im Deutschen Bundestag bekommen. Es ist kein Zufall, 
dass sich die AfD als Mehrheitsbeschafferin dieses An-
trages anbietet, denn das Abstimmungsverhalten eröffnet der AfD die strategische Möglichkeit, CDU/CSU und FDP beim Thema Migration mit ständig härteren Forde -
rungen vor sich herzutreiben. Das ist für mich weder inhaltlich noch vom Verfahren her vertretbar. Wissentlich auf Mehrheiten mit der AfD zu bauen, ist für mich inak-
zeptabel. Rechtsextreme dürfen im Deutschen Bundestag 
niemals das Zünglein an der Waage sein. Das haben wir nach dem Bruch der Ampelkoalition versprochen, und an 
dieses Versprechen halte ich mich."
"
Thomas Rachel",CDU/CSU,"Die AfD ist eine menschenverachtende, völkisch-na-
tionalistische Partei, die mit ihrer Forderung nach Re-migration Hass und Hetze predigt. Dies ist mit dem 
christlichen Menschenbild der CDU unvereinbar. Aus Deutscher Bundestag – 20. Wahlperiode – 211. Sitzung. Berlin, Freitag, den 31. Januar 2025                                 27616 
(A) 
(B) (C) 
(D) 
diesen sowie vielen weiteren Gründen ist eine Zusam-
menarbeit mit der AfD für mich und die CDU aus-
geschlossen – vor sowie nach der Bundestagswahl.
Wer dennoch behauptet und verbreitet, die CDU würde 
nun mit der AfD zusammenarbeiten, lügt schlicht und ergreifend.
Mit Blick auf das Abstimmungsverhalten im Deut-
schen Bundestag möchte ich zum Ausdruck bringen, dass mir die Entscheidung nicht leichtfällt. Auf jeden Fall haben wir mit der AfD nie gesprochen und schließen 
weiterhin jede Zusammenarbeit aus."
